sentence1,sentence2,score,tfidf_score,bert_score,hybrid_score
a man stares out a window,a man looks out the window,0.96,0.5101490193104814,0.91167384,0.7912163786141894
a woman is firing a rifle,a woman is cutting a lemon,0.04,0.3360969272762575,0.18827704,0.23262299440831058
a man is eating a banana,someone is peeling a banana,0.36,0.3360969272762575,0.60243356,0.522532565817536
the men are performing on stage,the comedic mimes performed on stage,0.52,0.3360969272762574,0.37910128,0.36619995377987735
a cartoon woman dives into a pool,a cartoon woman is diving off a board,0.5599999999999999,0.22576484600261612,0.7553952,0.5965060398565405
the lady put the baby int a trashcan,a woman puts a baby in a trash can,1.0,0.07397129483465995,0.7809889,0.5688835810048719
someone is frying meat,someone is playing paino,0.05,0.3360969272762575,0.20735925,0.24598055921524875
a man is rapidly chopping some mushrooms using a knife,a person is quickly chopping mushrooms with a knife,0.75,0.368023208756115,0.88422656,0.7293655550416904
a woman is adding ingredients to a bowl,a woman is cracking three eggs into a bowl,0.35,0.30412574187549346,0.5898905,0.5041610585917008
a skateboarder does tricks on a halfpipe,a man skateboards on a half pipe,0.7,0.11234277891542778,0.7237231,0.5403089952690192
a man is speaking on a stage,a man is speaking at a podium,0.6799999999999999,0.43161341897075156,0.6967217,0.6171891967994714
a man is playing a guitar,a man in a hat is playing a harp,0.27999999999999997,0.4501755023269897,0.5442293,0.5160131747802807
a man is playing on his keyboard,a man is playing a guitar,0.27999999999999997,0.4501755023269897,0.45723674,0.4551183576664044
a person is cutting a potato,a person is slicing a shallot,0.2,0.3360969272762575,0.48125383,0.43770675204724185
a man is dancing on the ceiling of a room,a man is dancing upsidedown on the ceiling,0.9199999999999999,0.6735205045780813,0.79428923,0.7580585894418143
two men are dancing,two women are shopping,0.08,0.3360969272762575,0.03589934,0.12595861621230953
someone is seasoning eggs,someone is seasoning two raw eggs in a bowl,0.72,0.5797386715376658,0.7418199,0.6931955382098044
a man is swinging in a rope,a gibbon is swinging in the trees,0.25,0.38087260847594373,0.44356722,0.4247588280597509
a man is cutting tomatoes,a woman is cutting broccoli,0.3,0.3360969272762575,0.461784,0.4240778817984473
a woman is boiling shrimp,a woman is combing her hair,0.2,0.2912194185636897,0.1835104,0.21582310358233628
a man cuts a potato,a man is slicing a potato,0.75,0.4112070550676187,0.8806018,0.739783398811698
a man is dancing on the road,a man is dancing,0.65,0.5797386715376657,0.7714139,0.7139113113154256
the deer jumped over the fence,a deer jumps over a cyclone fence,0.8,0.31710746658027106,0.8128182,0.6641050063734648
a girl dances in the rain,a woman is dancing in the rain,0.6,0.38087260847594373,0.82667494,0.692934251205045
a woman is writing a letter,a woman is sitting at a desk,0.33340000000000003,0.2912194185636897,0.35434052,0.3354041920060652
a gorilla is playing the drums,a monkey is playing drums,0.6666000000000001,0.5101490193104813,0.77795637,0.6976141385285874
a woman is riding on a horse,a woman is picking tomatoes,0.1,0.2912194185636897,0.1568236,0.19714234480805573
the boy cut the grass by the curb with scissors,a boy cuts grass with scissors,0.75,0.31089077468139725,0.8817965,0.7105247678620302
a man with glasses is talking,a man in a library is talking,0.65,0.43161341897075156,0.57674026,0.5332021991951013
a woman is cutting some flowers,a woman is cutting broccoli,0.2,0.5101490193104813,0.58527094,0.5627343706338426
a person is walking down a stone path,a man is walking down a sidewalk,0.7,0.38087260847594373,0.48866612,0.4563280705371679
a man plays the keyboard with his nose,the man is playing the piano with his nose,0.8800000000000001,0.5374158537043675,0.75539136,0.6899987195626958
a man is playing guitar,a cat is playing,0.08,0.4112070550676187,0.23955972,0.29105392843949796
a animal is eating,the animal is hopping,0.08,0.4112070550676187,0.50174266,0.4745819792197943
a man is lifting weights,a man is lifting a barbell,0.8400000000000001,0.6029748160380571,0.81556046,0.7517847787957921
a man is running with a bus,a man runs with a truck,0.5,0.2912194185636897,0.598897,0.5065936938876646
a man is climbing a rope,a man is sitting on a rock,0.05,0.2912194185636897,0.2558307,0.2664473102445143
a cat is playing the piano,a cat is licking its paw,0.05,0.25233420143369617,0.5412489,0.45457450273586447
a woman is dancing in the rain,a woman is adding oil to a dish,0.05,0.20199309249791841,0.21836692,0.21345476943276329
men are running a race,racers are running down a track,0.52,0.2912194185636897,0.6296538,0.5281234876269835
a man is cutting tomatoes into pieces,a woman is cutting potatoes,0.36,0.26055567105626243,0.41926616,0.37165299844746347
a man is playing a flute,a woman is applying eye liner,0.0,0.12735952979479354,-0.03153167,0.016135690871340397
a woman is cutting potatoes,a woman is slicing carrots,0.24,0.3360969272762575,0.6842662,0.5798154308649909
a chicken is pecking at a dead mouse,a rooster pecks at a dead mouse,0.72,0.38087260847594373,0.85095125,0.7099276546397985
the woman is thinly slicing a cucumber,the woman is slicing a tomato,0.24,0.5803329846765686,0.6521799,0.6306258172245648
a person is slicing a bread pieces,a man is slicing bread,0.64,0.5101490193104813,0.89739686,0.7812225274293443
a woman is cutting a squash,a woman is cutting big pepper,0.44000000000000006,0.5101490193104813,0.55376613,0.5406809798924943
a woman is adding oil on fishes,a woman is riding a horse,0.16,0.26055567105626243,0.4103495,0.3654113490581965
a woman is grating carrots,a woman is coating a pork chop,0.32,0.2912194185636897,0.3914173,0.3613579169864195
someone is cleaning a animal,a woman is cleaning a shrimp,0.5599999999999999,0.3360969272762575,0.5018398,0.4521169497820746
a man is talking on the phone,a man is talking,0.64,0.5797386715376657,0.7574549,0.704140023874172
a woman is smoking,a woman is making some food,0.16,0.35630042933313816,0.41530246,0.3976018297162317
a man laying down and shooting a gun,a man is laying on the ground shooting a rifle,0.76,0.2798280652432878,0.85859406,0.6849642257711065
a man is being put into an abulance,a man is pouring pasta onto a plate,0.0,0.18443191662261313,0.36088866,0.30795164291509813
a man is diving into a swimming pool,a man is singing into a microphone,0.13340000000000002,0.38087260847594373,0.3166311,0.335903561488706
a man is firing a shot gun,a man shoots a shotgun,1.0,0.1506401849870651,0.8011087,0.6059681699599256
a man playing the guitar,a man is playing a flute,0.36,0.3360969272762575,0.5320829,0.47328711889714115
a man is peeling potato,a man is playing a guitar,0.08,0.3360969272762575,0.20626006,0.24521110795468204
the woman is riding a horse,a man is riding a horse in an arena,0.4,0.3446421410380548,0.39228997,0.37799562173303203
an airplane moves along a runway,a plane is landing on a runway,0.5599999999999999,0.11234277891542777,0.7278352,0.5431874227745124
a woman is slipping in the watertub,a woman is lying in a raft,0.16,0.38087260847594373,0.40741903,0.3994551066318334
a man is mowing a lawn,a man is mixing,0.16,0.4112070550676187,0.19578354,0.2604105994151831
a woman is peeling a potato,a woman is hitting a man,0.15,0.3360969272762575,0.2254728,0.2586600317808997
a man is playing piano,a man is laying on the ground,0.15,0.26055567105626243,0.21465208,0.22842315626148932
a woman is doing ballet,a woman is riding on a horse,0.2,0.2912194185636897,0.31740996,0.30955279329962904
a woman is cutting an onion,a woman is rowing a boat,0.16,0.2912194185636897,0.15329185,0.19467012295670685
a woman is stirring rice in a pot,someone is putting rice in a pan,0.5538000000000001,0.3360969272762574,0.6121708,0.5293486549708258
a woman puts slabs of meat in a pan,a man puts pieces of meat into a plastic bag,0.48,0.2532094495161745,0.4571221,0.39594828416896977
the boy played his trumpet,a boy is playing the trumpet,0.8800000000000001,0.43161341897075156,0.94054925,0.7878684680206323
a person is riding a horse,a man is riding a motorcycle,0.36,0.3360969272762575,0.34199086,0.34022267006367557
a woman is slicing an onion,a woman is cutting a carrot,0.27999999999999997,0.2912194185636897,0.6229267,0.5234145120734709
a man is slicing vegetables,a woman is slicing a potato,0.45,0.3360969272762575,0.6265369,0.5394049122187506
a cat is playing,a woman is playing flute,0.05,0.4112070550676187,0.28074595,0.319884277884841
a man is riding a bicycle,a man is riding a bicycle around a parking lot,0.65,0.6348087971775132,0.71054065,0.6878210778644203
a band is performing on a stage,a band is playing and singing on a stage,0.9,0.5193879933129156,0.88663507,0.7764609077862026
the woman is slicing fish cake,the woman is riding a horse,0.16,0.38087260847594373,0.21367091,0.2638314131656469
a man is eating bread,a man is playing flute,0.16,0.3360969272762575,0.10821491,0.17657951109141223
a woman is cooking shrimp,a woman is dancing,0.16,0.4112070550676187,0.3704722,0.38269265741574765
a woman is dancing,a woman is slicing ginger,0.05,0.4112070550676187,0.21487147,0.27377214283216
a woman tosses a cat in the air and the cat hangs off a rod on the ceiling,a person throws a cat in the air and it grabs onto the ceiling,0.7,0.5141984347238064,0.7341299,0.6681504524866915
a big turtle is walking,the tortoise is walking,0.85,0.3360969272762575,0.5758434,0.5039194359633338
a man is burning a flag,a man is shooting a gun,0.1,0.3360969272762575,0.32295036,0.32689432643383853
the man is pushing the van,the woman is singing,0.0,0.3720557314537372,-0.08359403,0.05310089878387468
a man is eating wood,a man is adding oil to car,0.1,0.26055567105626243,0.19555408,0.2150545496941065
a dog is speaking to the camera,a dog is eating some water melon,0.12,0.20199309249791841,0.2697459,0.24942004817746086
a man is putting two paper towels on a paper plate,a man is putting papers on a dish,0.44000000000000006,0.33598136377577914,0.58004713,0.5068273886211065
a man and woman are walking,a man and woman walking hold each other,0.64,0.5193879933129156,0.81704986,0.7277512768200161
a man is cutting a rope with a sword,the man slced through a thick rope with a sword,0.8800000000000001,0.41120705506761873,0.7682941,0.661167971794486
the man is singing and playing the guitar,a man is playing a guitar,0.6,0.5023287782256718,0.76743567,0.6879036143179212
a man is cutting a paper,a person is tearing paper,0.5166000000000001,0.3360969272762575,0.641031,0.5495507850500952
a man is dancing,a rat is running,0.0,0.20199309249791836,0.14985913,0.16549931603691975
two boys are talking on the phone,a woman is talking on a telephone,0.36,0.20613696606828608,0.36288422,0.31586005220375607
a man is playing guitar,a woman is peeling a tuber,0.0,0.14438355527738675,0.010507114,0.050670046452194285
a woman is slicing an onion,a women slicing lemons,0.27999999999999997,0.1506401849870651,0.68577814,0.525236748250865
a woman is riding a horse,a man is running on rope,0.0,0.12735952979479354,-0.06805363,-0.009429681908625004
a man is playing soccer,a man is drawing some figures,0.08,0.2912194185636897,0.27442238,0.27946149269290144
a woman is peeling an orange,a man is playing a flute,0.0,0.12735952979479354,-0.03783282,0.011724885690671566
someone is cracking an egg open,a man is breaking an egg,0.6,0.38087260847594373,0.7467531,0.63698891438635
a man is cutting a snake to cook,a woman is cutting meat,0.4,0.26055567105626243,0.41266155,0.3670297939777827
a woman is scraping a carrot,a man is striking clay pots,0.0,0.12735952979479354,0.19654989,0.17579278363631404
a man and woman are bollywood dancing,a man an woman are dancing in the rain,0.33340000000000003,0.41120705506761873,0.53774023,0.4997802600311041
a woman is cutting flowers,a man is holding huge sunflowers,0.2,0.12735952979479354,0.17245543,0.15892665846989787
the man danced in the diner,the bomb exploded in the desert,0.0,0.4576241622696325,0.08002515,0.19330485240608467
american flag is waving,a american flag is blowing in the wind,0.8400000000000001,0.4073526042885674,0.75998724,0.6541968458350627
a lion is walking in an enclosed area,a lion is walking around,0.52,0.4073526042885674,0.87728554,0.7363056414779154
a woman is slicing a lemon,a man is showing a bread,0.05,0.14438355527738675,0.020167075,0.05743201877897961
a woman is playing the flute,a woman is slicing some tuna,0.08,0.25233420143369617,0.2487758,0.24984332147194083
the dog is barking at the toy,a dog is barking at an electronic toy duck,0.7,0.4211358913281959,0.7333429,0.6396807637363494
a woman is adding an egg and stirring,a woman is mixing an egg in a bowl,0.7,0.40298220897396103,0.8264475,0.6994078677436104
a woman covers a piece of meat with flour,a woman is seasoning a piece of meat,0.6,0.45026814465562653,0.67961335,0.6108097896720175
a white cat perched on a small wooden cabinet is looking outside the window,a cat perched on a table looks out the window,0.6799999999999999,0.34861427265775863,0.77712584,0.6485723308276315
a man does floor exercises,a man is exercising,0.72,0.1707761131901165,0.72928405,0.561731655692417
a man is slicing a potatoe,a man is peeling a banana,0.2,0.3360969272762575,0.46236938,0.4244876339289557
someone is playing piano,a person is playing a keyboard piano,0.72,0.5101490193104814,0.9006321,0.7834871463029406
the woman is putting makeup on the man,a woman is painting the face of a man,0.5599999999999999,0.44141890396079014,0.5978947,0.550951963035466
the woman droppped eggplant into the pan,a woman puts chopped eggplant into a skillet,0.8,0.2605556710562623,0.80382323,0.6408429522514796
a man plays a trumpet,a man is playing a musical instrument,0.6799999999999999,0.1506401849870651,0.67993975,0.5211498663748731
a woman is slicing a lemon,a woman in a kitchen peels a lemon,0.5334,0.2912194185636897,0.7350913,0.6019297436828154
a tiger trys to climb the wall,a lion is trying to climb up over a wall,0.6,0.2798280652432878,0.72259605,0.5897656540891302
a man is preparing a hanging rope,a man is tying a noose,0.9334,0.2912194185636897,0.5232335,0.4536292449588316
a woman dances on a stage,a woman is dancing,0.64,0.1707761131901165,0.7967928,0.6089877677911109
the girl is riding the horse,the girl is spraying the plants with water,0.04,0.5101490193104813,0.2906264,0.35648318152117936
a person is frying,a person is peeling a potato,0.24,0.4112070550676187,0.40986747,0.4102693423675299
a man is shooting a pistol,a woman is chopping garlic,0.16,0.14438355527738675,-0.015773484,0.03227362744486315
a woman is swinging her arms,a woman is slicing an onion,0.16,0.25233420143369617,0.12982418,0.16657718244148428
a man is walking outside,a man is dancing,0.15,0.4112070550676187,0.42772597,0.42277028412091733
a man dries his hands,a woman fixes her hair,0.05,0.0,0.14981577,0.10487103462219238
a soccer player is kicking the soccer ball into the goal from a long way down the field,a soccer player kicks the ball into the goal,0.65,0.6523857821698391,0.81323516,0.7649803253911556
a girl is playing the piano,a little girl is playing a grand piano on stage,0.6666000000000001,0.474330706497194,0.78969866,0.6950882444084172
a man is drawing some figures,a man is drawing on a digital dry erase board,0.6666000000000001,0.31710746658027106,0.570793,0.4946873270636199
the monkey is hanging from the trees,the monkey swung from branch to branch,0.4,0.3005524580213562,0.5737026,0.49175754501024294
some children are jumping on trampoline,two boy are playing on a trampoline,0.6,0.3360969272762574,0.71385753,0.6005293562266242
a woman with a knife is slicing a pepper,a women slicing green pepper,0.8,0.26055567105626243,0.8441756,0.6690895934105372
a man is adding oil to car,a man is putting antifreeze into a car,0.4,0.3360969272762574,0.5199228,0.4647750391814124
a man is slicing a carrot by a machine,a man is climbing a rope,0.08,0.26055567105626243,0.25257066,0.25496616256241555
a boy played a keyboard,a person is playing a piano keyboard,0.64,0.1506401849870651,0.64133936,0.49412959078206925
a cat is playing with an antenna,a boy is playing in the mud,0.08,0.20199309249791841,0.08248581,0.1183379939498703
a woman is slicing pumpkin,a person is slicing cantaloupe,0.4,0.3360969272762575,0.54788184,0.48434637330502384
the people threw the dummy over the cliff edge,some people are throwing a dummy off a cliff,0.9,0.1758302086833494,0.84895384,0.647016728944879
a gun is being fired,a potato is being peeled,0.1,0.3360969272762575,0.053240914,0.13809771679371707
a woman is cutting a plastic sheet,a woman is playing a guitar on streets,0.1,0.22576484600261612,0.26597503,0.2539119676338308
a woman cuts a pineapple,a woman is slicing a pineapple into pieces,0.8,0.3187840217537793,0.8352395,0.6803028891738389
a woman is adding spices on a meat,a woman adds ingredients to beef,0.75,0.10163066979112656,0.7652006,0.5661296194668485
a person is adding oil in the pan,the cook pouring oil into the pan,0.85,0.35081078411266137,0.7925727,0.6600441032681612
a cook seasons some dough,a man is seasoning some dough in a pan,0.75,0.23790309463326237,0.6985995,0.5603905905317786
a boy is running on a beach,two boys are playing in the beach,0.55,0.09349477497536716,0.58816934,0.4397669500344955
a baby monkey scratches itself,the monkey scratched his tummy,0.65,0.12735952979479354,0.7504469,0.5635206998770061
a boy is riding a bike on a gate,a woman is riding a horse,0.16,0.26055567105626243,0.084533334,0.13734003570680373
a man is doing a card trick,a man is squeezing water,0.05,0.2912194185636897,0.2293897,0.24793860772795853
a man is playing the piano,someone is playing guitar,0.15,0.2912194185636897,0.2919166,0.29170744577593977
a man is mowing grass,a guy is mowing the lawn,0.96,0.2912194185636897,0.88806254,0.7090096072310942
a person is mixing water and flour,a person is hitchhiking on a road,0.16,0.22576484600261612,0.19986732,0.20763657545911002
the two dogs were in the pen,the cowboy rode his horse in the desert,0.0,0.3609109455358704,0.21232146,0.2568982998732245
a man is riding on one wheel on a motorcycle,a person is performing tricks on a motorcycle,0.6,0.3590901389620649,0.61315596,0.536936214414297
a cat opens a drawer and climbs inside,a big cat opens a plastic drawer with his paws and then hops inside,0.75,0.4363080696344094,0.82884735,0.7110855828547393
a man is opening a box using a knife,a man is playing a guitar,0.0,0.26055567105626243,0.28368017,0.2767428238392329
a man is kicking oots of water,a woman is slicing a red pepper,0.05,0.10163066979112656,0.00030730804,0.030704316559606024
a man is eating,a woman is rock climbing,0.0,0.1707761131901165,-0.08376348,-0.007401599938314553
a puppy is repeatedly rolling from side to side while on its back,a dog is rolling from side to side,0.7,0.5684918552450584,0.80694115,0.7354063507858588
a young boy sings and plays a guitar,a kid plays the guitar,0.65,0.26055567105626243,0.74290943,0.5982032794952845
the woman is peeling lemon,the man is balancing on the wire,0.08,0.29667236689709064,-0.15996566,-0.022974250364355936
a man is playing the trumpet,someone is playing with a toad,0.16,0.25233420143369617,0.31923762,0.2991665971572512
a dog is looking around,a dog is watching a store counter,0.32,0.2912194185636897,0.6555602,0.546257962381317
a woman is slicing an onion,a man is shown slicing a carrot with a knife,0.24,0.2061369660682861,0.51748556,0.42408098707161496
the man drilled holes into the wood,a man drills wood,0.8400000000000001,0.25213870694526264,0.66097724,0.5383256771871097
someone is cutting a circle out of a pink sheet of paper,someone is pouring tomato sauce into a pot of meat,0.04,0.2456542425073261,0.20609954,0.217965947768601
a man is playing flute,a man is petting a tied up dog,0.04,0.26055567105626243,0.06633181,0.12459896919135802
a man is placing meat in a bag,a man is drivong a car,0.1,0.26055567105626243,0.18340358,0.20654920530323737
a girl is eating a cupcake,a man is playing a trumpet,0.0,0.14438355527738675,0.08760669,0.10463974866992218
a rabbit is sniffing and pawing a stuffed rabbit,a live rabbit is playing with a stuffed animal bunny,0.9,0.3227832750340331,0.67462826,0.5690747450548419
a man is buttering bread,a woman is ridint a horse,0.0,0.14438355527738675,-0.093793884,-0.022340649180352855
a woman is squeezing some cucumber slices,a woman is getting doused in green slime,0.15,0.18443191662261313,0.41393813,0.3450862604821605
a man is taking out the insides of a green pepper,someone is removing the seeds from a bell pepper,0.8,0.21693381701139694,0.5766424,0.4687298030681255
a man takes a piece of pepperoni pizza out of a pizza box and puts it on the lid after he closes the box,the man took a piece of pepperoni pizza out of the box,0.55,0.6512918043139247,0.846782,0.7881349315644106
the man added vegetables to the broth in the pot,a man is adding sliced vegetables to a cooking bowl with water,0.6799999999999999,0.13656182108090958,0.6805165,0.5173300892644126
the man ran and jumped against the wall,a man jumps into a wall,0.6799999999999999,0.19431434016858143,0.6828446,0.5362854955835181
the man is seasoning the sausages,the man added seasoning to water in a bowl,0.48,0.3533721544668105,0.4067539,0.39073936874643045
a clown is singing and people are dancing,a clown is singing,0.6,0.5245910904457137,0.82893324,0.7376305705800642
a woman is feeding an aardvark,a woman is chopping up garlic,0.08,0.25233420143369617,0.346079,0.31795554581237967
a person is rinsing a steak off with water,a man is rinsing a large steak,0.7857999999999999,0.3446421410380548,0.76873255,0.6415054019015654
a boy rode his bike on top of a metal fence,a bmx biker rides along the top of a fence,0.6,0.21693381701139694,0.6167759,0.49682326029011037
a man is throwing knives at a tree,a man is showing magic,0.35,0.26055567105626243,0.106210604,0.1525141228437876
girls are walking on the stage,women models are walking down a catwalk,0.52,0.20199309249791841,0.34989512,0.305524514496545
a woman is doing weight exercises,a woman is exercising with a barbell,0.7,0.25233420143369617,0.7743436,0.6177407872970216
a man is peeling a potato,a man is hiking,0.1,0.4112070550676187,0.18074627,0.24988450855481625
a large bird standing on a table picks up a plastic glass containing liquid and places it in a bowl of something,a bird picks up a plastic cup containing a liquid with its beak and puts the cup into a bowl,0.7,0.2882537840392769,0.8286443,0.6665271400984103
a woman is in the rain,a car is driving along the road,0.0,0.22576484600261612,0.09807977,0.13638529485331702
a woman is hitting a man,a man is holding a slow loris,0.0,0.2912194185636897,0.055017274,0.12587791765279946
a woman is riding an elephant,a man is lifting himself,0.0,0.12735952979479354,-0.018049829,0.025572979028982284
a man is lifting weights,a woman is exercising her abs,0.2,0.12735952979479354,0.19131967,0.17213162793563044
a person is riding a jetski in the waves,a woman is riding a seadoo,0.4,0.23790309463326237,0.45471132,0.3896688510012153
a woman is wearing headphones,a woman is chopping some shiso leaves,0.12,0.26055567105626243,0.17916003,0.2035787184238886
a kitten is eating its food from a plate,a kitten eats some food,0.8,0.23790309463326237,0.8832602,0.6896530676912788
a woman is reading a lifestyle magazine,a woman is slicing a meat into pieces,0.1,0.22576484600261612,0.11587283,0.14884043043719458
a man is pouring chili into a bowl,a man opens a can and pours the contents into a bowl,0.5,0.2605556710562623,0.61733276,0.5102996308804011
the bird ate the food in the tree from a bowl,a bird is eating from a bowl,0.65,0.21248275333494784,0.8271117,0.6427230068857993
a group of girls are exiting a taxi,a video clip of rihanna leaving a taxi,0.4,0.20199309249791841,0.5042414,0.4135669185521404
a woman is seasoning a piece of meat,a man is loading a rifle with bullets,0.0,0.09193998174078082,0.10160364,0.09870454399647359
a man is chopping coriander leaf,a man is playing a guitar,0.16,0.2912194185636897,0.28715727,0.2883759037608641
a man takes a slice of pizza,a man talks on his cell phone,0.16,0.10163066979112656,0.25934288,0.21202921329695712
a man is placing meat inside a plastic bag,a woman is carrying a wallaby in a bag,0.08,0.18443191662261313,0.32335663,0.2816792118991298
a rabbi is talking,a man is walking on a rope,0.0,0.1506401849870651,0.10501576,0.11870308974637893
a man rides a horse,a woman rubs a babys leg,0.0,0.0,-0.112033434,-0.0784234032034874
a man is playing guitar,smeone is laying down,0.0,0.14438355527738675,-0.061122634,0.0005292246115802049
a man is slicing a bun,a man is breaking pots,0.08,0.3360969272762575,0.30661964,0.31546282611817233
a man  is driving a car,a woman dips a shrimp in batter,0.0,0.0,-0.13474478,-0.0943213403224945
a dog is pawing at a fly in the carpet before it,the dog played with a bug on the carpet,0.72,0.26153167277956885,0.64382774,0.5291389232587363
a dog is barking,a jet is flying,0.046200000000000005,0.20199309249791836,0.039623506,0.08833438108883301
a monkey is walking on a bed,a man is riding a horse,0.0,0.12735952979479354,0.045613367,0.07013721405313647
a woman is cooking broccoli,a man is eating his food,0.1,0.12735952979479354,0.11844571,0.12111985697196162
a man is frying a tortilla,a person is performing a card trick,0.0,0.12735952979479354,0.14088498,0.13682734234975016
a woman serving volleyballs over a net,one woman hands volleyballs to another woman who serves them,0.55,0.2455839635926099,0.698244,0.5624459720253232
a man is slicing cucumber with a knife,a man is cooking a tortilla in a skillet,0.15,0.20199309249791841,0.3327567,0.29352761942170064
a man is playing an electronic keyboard,a band is playing instruments,0.25,0.26055567105626243,0.17120817,0.1980124194622492
