sentence1,sentence2,score,tfidf_score,bert_score,hybrid_score
a plane is taking off,an air plane is taking off,1.0,0.7092972666062738,0.9372146,0.8688393852125951
a man is playing a large flute,a man is playing a flute,0.76,0.8181802073667197,0.89196694,0.8698308956488892
a man is spreading shreded cheese on a pizza,a man is spreading shredded cheese on an uncooked pizza,0.76,0.6152186908963321,0.8842055,0.803509477336496
three men are playing chess,two men are playing chess,0.52,0.6694188517266485,0.7712636,0.740710163174092
a man is playing the cello,a man seated is playing the cello,0.85,0.8466473536503037,0.92587733,0.9021083508971846
some men are fighting,two men are fighting,0.85,0.6029748160380572,0.88325274,0.799169338903977
a man is smoking,a man is skating,0.1,0.5031026124151314,0.3390217,0.38824597654318105
the man is playing the piano,the man is playing the guitar,0.32,0.7799154245579976,0.45490912,0.5524110115684491
a man is playing on a guitar and singing,a woman is playing an acoustic guitar and singing,0.44000000000000006,0.5056055588739691,0.6308914,0.5933056236272328
a person is throwing a cat on to the ceiling,a person throws a cat on the ceiling,1.0,0.5727393584196199,0.9628879,0.8458432899935373
the man hit the other man with a stick,the man spanked the other man with a stick,0.8400000000000001,0.8477624970048978,0.78244096,0.8020374392679428
a woman picks up and holds a baby kangaroo,a woman picks up and holds a baby kangaroo in her arms,0.9199999999999999,0.7358969498063693,0.9629829,0.8948570861931315
a man is playing a flute,a man is playing a bamboo flute,0.7734,0.8181802073667197,0.88675,0.8661790382727905
a person is folding a piece of paper,someone is folding a piece of paper,0.9334,0.7168117414430624,0.98582226,0.9051190987383081
a man is running on the road,a panda dog is running on the road,0.33340000000000003,0.6327904583679949,0.52584445,0.5579282439251934
a dog is trying to get bacon off his back,a dog is trying to eat the bacon on its back,0.75,0.46598909712311054,0.91061294,0.7772257876887215
the polar bear is sliding on the snow,a polar bear is sliding across the snow,1.0,0.748195020164401,0.96009636,0.8965259694473
a woman is writing,a woman is swimming,0.1,0.5031026124151314,0.39948863,0.4305728292224337
a cat is rubbing against babys face,a cat is rubbing against a baby,0.76,0.5803329846765686,0.9384448,0.8310112685413983
the man is riding a horse,a man is riding on a horse,1.0,0.6694188517266485,0.9480651,0.8644712210277907
a man pours oil into a pot,a man pours wine in a pot,0.64,0.43161341897075156,0.7052865,0.6231845597965264
a man is playing a guitar,a girl is playing a guitar,0.5599999999999999,0.6029748160380572,0.58497894,0.5903776955228582
a panda is sliding down a slide,a panda slides down a slide,0.9199999999999999,0.5101490193104813,0.9469581,0.8159154109208604
a woman is eating something,a woman is eating meat,0.6,0.6029748160380571,0.7326075,0.6937176954370274
a woman peels a potato,a woman is peeling a potato,1.0,0.4112070550676187,0.9537916,0.7910162136005163
the boy fell off his bike,a boy falls off his bike,0.96,0.5803329846765686,0.929598,0.8248184651585247
the woman is playing the flute,a woman is playing a flute,1.0,0.5797386715376657,0.9763875,0.8573928639162862
a rabbit is running from an eagle,a hare is running from a eagle,0.8400000000000001,0.5803329846765686,0.826272,0.7524903148861554
the woman is frying a breaded pork chop,a woman is cooking a breaded pork chop,0.8400000000000001,0.6327904583679949,0.9018704,0.8211464083691631
a girl is flying a kite,a girl running is flying a kite,0.8,0.8181802073667197,0.85418737,0.84338520883172
a man is riding a mechanical bull,a man rode a mechanical bull,0.8,0.5101490193104813,0.9349371,0.8075006655900498
the man is playing the guitar,a man is playing a guitar,0.9818,0.5797386715376657,0.96796215,0.8514951035250509
a woman is dancing and singing with other women,a woman is dancing and singing in the rain,0.6,0.4576241622696325,0.53749734,0.5135353699424864
a man is slicing a bun,a man is slicing an onion,0.48,0.5101490193104813,0.593475,0.5684771887509843
a man is pouring oil into a pan,a man is pouring oil into a skillet,0.8400000000000001,0.7168117414430624,0.8749807,0.8275300040994836
a lion is playing with people,a lion is playing with two men,0.6799999999999999,0.5803329846765686,0.77180076,0.7143603891583111
a dog rides a skateboard,a dog is riding a skateboard,1.0,0.4112070550676187,0.979628,0.8091017529414892
someone is carving a statue,a man is carving a statue,0.75,0.6029748160380572,0.9123094,0.8195090067010656
a woman is slicing an onion,a man is cutting an onion,0.55,0.43161341897075156,0.72069275,0.633968917582705
a woman peels shrimp,a woman is peeling shrimp,1.0,0.4112070550676187,0.95522636,0.7920205518649817
a woman is frying fish,a woman is cooking fish,0.8,0.6029748160380571,0.8552071,0.7795374166589513
a woman is playing an electric guitar,a woman is playing a guitar,0.72,0.7092972666062738,0.90550035,0.8466393968474217
a baby tiger is playing with a ball,a baby is playing with a doll,0.32,0.5803329846765686,0.33969903,0.41188921336847806
a person is slicing a tomato,a person is slicing some meat,0.35,0.5101490193104813,0.73131907,0.6649680189340135
a person cuts an onion,a person is cutting an onion,1.0,0.5101490193104814,0.9766344,0.8366887621133349
a man is playing the piano,a woman is playing the violin,0.2,0.43161341897075156,0.24670039,0.30217429802246326
a woman is playing the flute,a man is playing the guitar,0.2,0.43161341897075156,0.27074364,0.31900456354446644
a man is cutting up a potato,a man is cutting up carrots,0.475,0.6694188517266485,0.70410514,0.6936992347816817
a kid is playing guitar,a boy is playing a guitar,0.76,0.6029748160380572,0.8725719,0.7916927706819311
a boy is playing guitar,a man is playing a guitar,0.64,0.6029748160380572,0.69130516,0.6648060452562109
a man is playing guitar,a boy is playing a guitar,0.64,0.6029748160380572,0.69847035,0.6698216867070929
a little boy is playing a keyboard,a boy is playing key board,0.8800000000000001,0.43161341897075156,0.7697399,0.6683019678337121
a man is playing a guitar,a man is playing an electric guitar,0.75,0.7092972666062738,0.88094217,0.8294487020384618
a dog licks a baby,a dog is licking a baby,0.95,0.4112070550676187,0.9553555,0.7921109721111059
a woman is slicing an onion,a man is cutting and onion,0.64,0.25233420143369617,0.6948571,0.5621002388293855
a man is playing the guitar,a man is playing the drums,0.31120000000000003,0.6694188517266485,0.46409106,0.5256893873791091
a woman is slicing a pepper,a woman is cutting a red pepper,0.7876000000000001,0.5101490193104813,0.81256324,0.7218389562814256
a man is playing the drums,a man plays the drum,1.0,0.2912194185636897,0.90418416,0.7202947334403532
a woman rides a horse,a woman is riding a horse,1.0,0.4112070550676187,0.9755366,0.8062376901553869
a man is eating a banana by a tree,a man is eating a banana,0.8,0.7092972666062738,0.899868,0.8426967880141087
a cat is playing a key board,a man is playing two keyboards,0.32,0.25233420143369617,0.38580912,0.3457666409309023
a man chops down a tree with an axe,a man cut a tree with an axe,0.95,0.6327904583679949,0.9033389,0.8221743500729595
a kid plays with a toy phone,a little boy plays with a toy phone,0.7,0.5803329846765686,0.8965655,0.8016957372875836
a man is riding a motorcycle,a man is riding a horse,0.27999999999999997,0.6029748160380571,0.4956556,0.5278513502698674
a man is riding a motorcycle,a man is riding a horse,0.27999999999999997,0.6029748160380571,0.4956556,0.5278513502698674
a squirrel is spinning around in circles,a squirrel runs around in circles,0.8,0.5803329846765686,0.86235106,0.7777456373425152
a man and a woman are kissing,a man and woman kiss,1.0,0.5101490193104813,0.947456,0.8162639192788621
a man is getting into a car,a man is getting into a car in a garage,0.7666000000000001,0.7474073540060465,0.7788962,0.7694495550062879
a man is dancing,a man is talking,0.12,0.5031026124151314,0.3990847,0.4302900647876192
a man is playing the guitar and singing,a man is playing the guitar,0.5833999999999999,0.7474073540060465,0.79784673,0.7827149263289197
a person is cutting mushrooms,a person is cutting mushrooms with a knife,0.8400000000000001,0.7092972666062738,0.9298475,0.8636823913466283
a tiger cub is making a sound,a tiger is walking around,0.4,0.2912194185636897,0.584371,0.49642549911685163
a person is slicing onions,a person is peeling an onion,0.52,0.2912194185636897,0.8000215,0.6473809079284208
a man is playing the piano,a man is playing the trumpet,0.32,0.6694188517266485,0.5227696,0.566764348802983
a woman is peeling a potato,a woman is peeling an apple,0.4,0.5101490193104813,0.72374237,0.6596643380372544
a pankda is eating bamboo,a panda bear is eating some bamboo,0.8400000000000001,0.45017550232698983,0.7250862,0.6426129634460522
a person is peeling an onion,a person is peeling an eggplant,0.4,0.6694188517266485,0.6505542,0.6562135756592147
a monkey pushes another monkey,the monkey pushed the other monkey,0.96,0.35630042933313816,0.90678275,0.7416380512204431
a squirrel runs around in circles,a squirrel is moving in circles,0.8800000000000001,0.43161341897075156,0.90277106,0.7614237348777795
a man is tying his shoe,a man ties his shoe,1.0,0.5101490193104813,0.90425825,0.7860254697053453
a boy is singing and playing the piano,a boy is playing the piano,0.6,0.7474073540060464,0.8670056,0.8311261168387157
a dog is eating water melon,a dog is eating a piece of watermelon,0.85,0.38087260847594373,0.7708491,0.6538561347881139
a woman is chopping broccoli,a woman is chopping broccoli with a knife,0.85,0.7092972666062738,0.9570003,0.8826894184958287
a man is peeling a potato,a man peeled a potatoe,0.76,0.1707761131901165,0.87843,0.6661338401788062
a woman is playing a guitar,a man plays a guitar,0.48,0.1707761131901165,0.6345954,0.49544959196980654
a woman is slicing tomato,a man is slicing onion,0.32,0.3360969272762575,0.5528237,0.48780567787617557
a man swims underwater,a woman is swimming underwater,0.4,0.1707761131901165,0.6119058,0.47956689128812013
a man and woman are talking,a man and woman is eating,0.32,0.43161341897075156,0.51622784,0.4908435027343773
a small dog is chasing a yoga ball,a dog is chasing a ball,0.8,0.7092972666062738,0.66569924,0.6787786504637547
the men are playing cricket,the men are playing basketball,0.44000000000000006,0.6694188517266485,0.4752873,0.5335267425159804
a man rides off on a motorcycle,a man is riding on a motorcycle,0.8800000000000001,0.43161341897075156,0.8897083,0.7522797863227868
a man is playing a guitar,a man is singing and playing a guitar,0.72,0.7092972666062738,0.7968291,0.7705695649992772
the man talked on the telephone,the man is talking on the phone,0.72,0.5507796339456279,0.83226043,0.7478161851246369
a man is fishing,a man is exercising,0.1,0.5031026124151314,0.31976327,0.3747650748250414
a man is levitating,a man is talking,0.16,0.5031026124151314,0.31569946,0.3719203984496523
two boys are driving,two bays are dancing,0.12,0.3360969272762575,0.09675389,0.16855680041045062
a man is riding on a horse,a girl is riding a horse,0.52,0.5101490193104813,0.5721134,0.5535240821092149
a man is riding a bicycle,a monkey is riding a bike,0.4,0.3360969272762575,0.49938172,0.45039628289669864
a man is slicing potatoes,a woman is peeling potato,0.44000000000000006,0.14438355527738675,0.54361117,0.42384289074665293
a woman is peeling a potato,a man is slicing potato,0.48,0.3360969272762575,0.58911794,0.5132116212698828
a man is playing a guitar,someoen is playing guitar,0.72,0.6029748160380572,0.68411505,0.6597729694467321
a woman is slicing a leek,a woman is slicing ginger,0.44000000000000006,0.6029748160380571,0.642917,0.6309343349557652
the man cut a paper plate,a man is cutting a paper plate,0.96,0.43161341897075156,0.96403563,0.8043089787704492
the man is playing the guitar,a man is playing the flute,0.3286,0.6827531502984261,0.4725983,0.5356447472078292
a man is playing the piano,the man is playing the violin,0.35,0.6827531502984261,0.48297638,0.5429093911153762
a woman is slicing up some meat,a woman is breading some meat,0.45,0.5803329846765686,0.69085824,0.6577006608696606
a man is playing on his keyboard,a man is playing a keyboard piano,0.8,0.5803329846765686,0.8137536,0.7437274188252118
the lady chopped up the green onions,the lady cut up a green onion,0.96,0.5358559548726153,0.91730094,0.8028674322328112
someone is sitring noodles in water,a woman is boiling noodles in water,0.64,0.5031026124151314,0.7133697,0.6502895867583681
lionel richie is dancing on the ceiling,lionel ritchie dances while standing on the ceiling,0.8,0.368023208756115,0.82862306,0.6904430663522678
a man is playing a piano,a person is playing the piano,0.8800000000000001,0.5101490193104814,0.87718534,0.767074411317589
a woman is playing flute,a woman plays on a flute,0.9199999999999999,0.3360969272762575,0.9677565,0.7782586350294959
a boy is checking a calender,a boy is looking at a calendar,0.76,0.2912194185636897,0.8837414,0.7059847907180327
a woman is cutting an onion,a woman is chopping onions,0.96,0.2912194185636897,0.86979413,0.696221728717758
a man is playing guitar,a man plays a guitar,0.9714,0.4112070550676187,0.9765762,0.8069654628680945
a woman is using a sewing machine,a woman is sewing on a machine,1.0,0.6694188517266485,0.94074655,0.8593482018093459
a woman is flipping pancakes,a cartoon chef is flipping pancakes,0.5065999999999999,0.5101490193104814,0.6737552,0.6246733717172167
a man is running on the road,a car is driving down the road,0.2,0.3360969272762574,0.41564566,0.3917810454222571
a man is riding on a horse,a man is talking on a phone,0.2,0.43161341897075156,0.33286938,0.36249258920974964
a man is riding a bike,a man is riding on a horse,0.4,0.5101490193104813,0.5428434,0.5330350748746415
a woman is dancing,a man is eating,0.028599999999999997,0.20199309249791836,-0.08826364,-0.001186619072933992
a man is playing a piano,a man is playing a flute,0.4,0.6029748160380571,0.54721105,0.5639401745420232
a man is playing a flute,a man is playing a piano,0.32,0.6029748160380571,0.54721105,0.5639401745420232
a man is spinning,a man is dancing,0.32,0.5031026124151314,0.6043176,0.5739531135318209
a monkey is swinging from limb to limb,a monkey is swinging from tree to tree,0.6799999999999999,0.3875569814434229,0.783071,0.6644167993661934
the people got off the train,the people got off the train at the station,0.8,0.8587399046062805,0.91000205,0.8946234262120538
a dog is jumping on a trampoline,a dog bounces on a trampoline,0.96,0.5101490193104813,0.8828609,0.7710472993104478
a boy is playing an instrument,a man is playing a trumpet,0.5,0.2912194185636897,0.47113526,0.4171605006808775
a woman plays the guitar,a man sings and plays the guitar,0.35,0.45017550232698983,0.46161732,0.45818477822151915
a woman is picking a can,a woman is slicing a tomato,0.2,0.3360969272762575,0.30598184,0.31501637242764347
a man is climbing a rope,a man climbs up a rope,1.0,0.3360969272762575,0.8895711,0.7235288157317054
a man is lifting a car,a man is climbing a wall,0.27999999999999997,0.3360969272762575,0.32287464,0.326841323003472
a man and woman are driving down the street in a jeep,a man and woman are driving down the road in an open air vehicle,0.8,0.5473319019216166,0.715631,0.6651412643592913
the shirtless man sat in a chair,a shirtless man is sitting on a chair,0.76,0.3360969272762574,0.92528653,0.7485296263548743
two women are wrestling,two women are wrestling on the floor,0.8,0.6348087971775132,0.85254216,0.7872221644332527
the puppy played with a blue tennis ball,a puppy is playing with a tennis ball,0.8,0.45026814465562653,0.8728412,0.7460692391539816
a kangroo is eating something,a kangaroo is eating,0.96,0.4112070550676187,0.6622102,0.5869092568801642
a cat is playing a piano,a man is playing a guitar,0.12,0.3360969272762575,0.31237122,0.31948892615765445
the man cut some carpet with a knife,a man is cutting carpet with a knife,0.95,0.45026814465562653,0.9639096,0.809817181601644
a woman is riding a motorized scooter down a road,a man is riding a motor scooter,0.44000000000000006,0.3446421410380548,0.5939619,0.5191659744304045
someone is slicing a vegetable,someone is slicing a tomato,0.6,0.6029748160380571,0.78972936,0.73370299454744
a woman is dancing,a man is talking,0.0,0.20199309249791836,-0.05911898,0.0192146426739494
a dog licks up a babys drool,a dog licks a baby,0.44000000000000006,0.35630042933313816,0.8609221,0.7095355855908655
a man is rowing a boat,a man is slicing a tomato,0.08,0.3360969272762575,0.15755577,0.21111811541050785
a man cuts up potatos,a man slices potatoes,0.96,0.1707761131901165,0.8048639,0.6146375728600806
a woman is chopping up garlic,the woman is dicing garlic,0.96,0.43161341897075156,0.7987867,0.6886347214920068
an animal run in circles,a squirrel runs in circles,0.76,0.2912194185636897,0.74905103,0.611701567565872
a man is walking slowly across a rope bridge,a boy is walking across a bridge,0.6,0.5193879933129156,0.65280414,0.6127792814663173
a man is playing the guitar,a man seated in a room is playing the guitar,0.8,0.6764792400877004,0.69852364,0.6919103264296151
a man plays the flute,a man is playing a flute,1.0,0.3360969272762575,0.987548,0.7921126618239295
a woman cracks two eggs into a glass bowl,a woman is cracking an egg into a bowl,0.76,0.27519581217502304,0.91774076,0.7249772474137984
a man is cutting a fish,a man guts a fish,0.6,0.4112070550676187,0.74063826,0.6418088600085974
two men are packing suitcases into the trunk of a car,the men are putting suitcases into the cars trunk,0.8800000000000001,0.5217036322697,0.8742096,0.768457791684389
a man pours oil on some tomatos,the man poured oil on the cut tomatoes,0.76,0.24478531173455212,0.83936536,0.6609913596260175
a man is slicing something,a man is slicing a bun,0.6,0.6029748160380571,0.7658912,0.717016257010056
a man is paddling a canoe,a man is playing a harp,0.13340000000000002,0.3360969272762575,0.2017398,0.24204693578213565
a man and woman are walking together through the woods,a man and woman are walking arm in arm through a wooded area,0.8,0.39018614727174444,0.7715574,0.6571459878620959
the woman picked up the kangaroo,a woman picks up a baby kangaroo,0.75,0.31710746658027106,0.8976355,0.7234770738249419
fish are swimming,a fish is swimming,0.8266,0.5031026124151314,0.88903475,0.7732550716159273
two women mix something in a food processor,two women make something in a blender,0.8,0.45026814465562653,0.7567824,0.6648281083251242
a person is surfing a large wave,a person is surfing,0.72,0.6569729210330907,0.8092685,0.7635797846732695
a man is playing a guitar,a man is stabbing a target,0.24,0.3360969272762575,0.2078283,0.246308891400994
a man is playing a flute in a band,a man is playing a guitar,0.32,0.4501755023269897,0.5200967,0.4991203541835858
the man spread butter on the loaf of bread,a man is spreading butter onto bread,0.8,0.23157052612297283,0.909582,0.7061785829543845
a person is boiling noodles,a woman is boiling noodles in water,0.8,0.45017550232698983,0.8412181,0.7239052946647717
a group of people dance on a hill,a group of people are dancing,0.64,0.38087260847594373,0.7435802,0.6347679261127294
a man is dancing outside,a man is playing flute,0.2,0.3360969272762575,0.32867348,0.33090051852196567
a woman is feeding a man,a woman is mixing meat,0.2,0.3360969272762575,0.33466092,0.3350917234274756
a man is putting a pan into an oven,a woman is cutting an onion,0.12,0.2061369660682861,0.165602,0.17776249030790878
a woman is sitting at a desk,a woman is riding a donkey,0.08,0.2912194185636897,0.2765526,0.2809526369924086
medics transport a patient on a stretcher,a doctor rushes a patient on a stretcher,0.6799999999999999,0.43161341897075156,0.71712023,0.6314682047111535
a woman is playing a flute on stage,the woman is playing the flute,0.72,0.41120705506761873,0.8974116,0.7515501901553869
two baby pandas are playing,two pandas are laying together,0.6,0.43161341897075156,0.72172683,0.6346928159935021
a baby is laughing,a baby is laughing and giggling,0.8,0.6569729210330907,0.9343071,0.8511068213401396
a man is playing a guitar,a boy is playing a piano,0.24,0.3360969272762575,0.28386638,0.29953554116219394
a man is folding paper,a woman is slicing a pepper,0.12,0.14438355527738675,-0.029967263,0.022337982989609075
three women are dancing,the man is dancing,0.32,0.14438355527738675,0.2614609,0.22633769977813942
the cats are playing with each other,two cats are fighting each other,0.52,0.45026814465562653,0.76229763,0.668688760771871
a person is writing,a person is writing with a pencil,0.72,0.6569729210330907,0.80088466,0.7577111113486845
a man is running,a man is running down a road,0.7,0.6569729210330907,0.7467794,0.7198374259887297
the woman is rolling dough,a woman is flouring and rolling dough,0.753,0.5803329846765686,0.889033,0.796422991201463
a woman is adding spices on a meat,woman is adding sugar to meat,0.55,0.5031026124151314,0.66931313,0.6194499647376467
a woman is adding oil on fishes,a woman is pouring water on fish,0.45,0.3360969272762574,0.7468828,0.6236470475050818
a young boy is holding a guitar,a little boy is playing a guitar,0.55,0.43161341897075156,0.7775666,0.6737806479675317
a cheetah is running,a cheetah is running across a field,0.76,0.6569729210330907,0.8780421,0.8117213237701018
the man is eating pizza,a man is eating a slice of pizza,0.96,0.5803329846765686,0.8483305,0.767931255743089
an orangutan is riding a bus,a monkey is riding on a bus,0.72,0.43161341897075156,0.66215295,0.5929910819274926
a man and a woman talk in a diner,a man and a woman are riding on a bicycle,0.24,0.30412574187549346,0.40594256,0.3753975021112931
a man is playing a guitar,a man is cleaning a glass door,0.08,0.2912194185636897,0.17836326,0.21222010711379227
a girl is singing and playing a guitar,a young man is singing while playing the guitar,0.48,0.41120705506761873,0.62057436,0.5577641651080847
a girl is communicating with sign language,a young girl is using sign language,0.7882,0.5031026124151314,0.9151804,0.7915570354220797
a woman is doing weight exercises,a woman is doing her hair,0.1,0.43161341897075156,0.43076873,0.4310221354705834
a man is getting inside a car,an elderly man is getting into a red car,0.75,0.474330706497194,0.6141692,0.572217620343018
a big green ball knocks a potato over,a large green ball hits a potato,0.8,0.38087260847594373,0.89327645,0.7395552758136571
a cat is playing keyboards,a cat is playing a piano,0.6,0.6029748160380571,0.822197,0.756430364809586
two dogs swim in a pool,dogs are swimming in a pool,0.8400000000000001,0.43161341897075156,0.8816554,0.7466427962524438
the man used a chopper to chop the onion,the man used a machine to chop up a potatoe,0.4,0.5250790579579575,0.6812998,0.6344335634548158
a woman slices tofu,a woman is cutting tofu,1.0,0.4112070550676187,0.85240805,0.7200477644847632
a herd of deer are crossing the street,a herd of caribou are crossing a road,0.6,0.45026814465562653,0.6537881,0.5927320883418326
the person is riding the horse,a man is riding a horse,0.76,0.3748077700589727,0.78455895,0.6616335675136635
someone is feeding a animal,someone is playing a piano,0.0,0.3360969272762575,0.068954274,0.1490970685336005
someone is slicing tortilas,someone is riding a horse,0.0,0.3360969272762575,0.06664421,0.14748002059787624
someone is mixing ingrediants,someone is sewing things,0.05,0.3360969272762575,0.27207232,0.2912797018143546
a rooster pecks at a dead mouse,a chicken is pecking at a dead mouse,0.8,0.38087260847594373,0.85095125,0.7099276546397985
a woman holds a kangaroo,a woman is picking up a kangaroo,0.65,0.35630042933313816,0.7763772,0.6503541337933801
a man is playing with frogs,a cat is playing with a camera,0.15,0.43161341897075156,0.19145375,0.2635016571027779
two men are talking,two men are playing guitar,0.3,0.5101490193104813,0.429742,0.45386410276580064
a man spreads butter on a big piece of bread,a man is smearing butter on a slice of garlic bread,0.7,0.4211358913281959,0.7086102,0.6223678794055999
a man is running across a high wire,a man is running on rope,0.6,0.38087260847594373,0.6213358,0.5491968456664861
a man is mowing a lawn,a woman is cutting a lemon,0.04,0.14438355527738675,0.116511784,0.12487331647402031
a man is opening a door,a man is playing a guitar,0.16,0.3360969272762575,0.23146212,0.2628525628897559
a man is slicing a potato into pieces,a man is cutting a potato,0.8400000000000001,0.4501755023269897,0.8623023,0.7386642391761853
the woman is cutting cooked octopus,a woman is chopping octopus,0.76,0.45017550232698983,0.85777116,0.7354924376091077
a man is punching through boards,a dog is running through water,0.08,0.25233420143369617,0.0050291866,0.0792206909614616
a man is dancing,a man is eating bread,0.16,0.4112070550676187,0.19607168,0.2606122866319418
someone is playing a piano,a man is playing a guitar,0.24,0.3360969272762575,0.41576782,0.3918665482851874
two foxes are eating from a plate on a brick patio,foxes are eating from a plate,0.5599999999999999,0.6225407468137513,0.857033,0.7866852982895782
a boy is playing a keyboard,a boy is playing the piano,0.64,0.5101490193104813,0.72435653,0.6600942663400193
a person plays a keyboard,someone is playing a keyboard,1.0,0.1707761131901165,0.9630829,0.7253908706658667
a man is shooting a gun,a man is spitting,0.0,0.4112070550676187,0.25760993,0.3036890700505972
someone is slicing an onion,someoen is peeling a potato,0.2,0.12735952979479354,0.46748507,0.3654474021379772
a man is swimming,a woman is slicing meat,0.0,0.1707761131901165,-0.042525977,0.021464650129634742
a man is playing the guitar,a man plays an acoustic guitar,0.75,0.25233420143369617,0.90167725,0.7068743479545229
a woman is slicing a pumpkin,a woman is riding an elephant,0.08,0.2912194185636897,0.19107671,0.2211195276135939
