sentence1,sentence2,score,tfidf_score,bert_score,hybrid_score
two sumo ringers are fighting each other,a man rides a water toy in the water,0.0,0.0,0.03367221,0.023570546880364418
a man lays on the ground and aims a rifle,a man is spreading butter on a tortilla,0.0,0.17077611319011654,0.17084129,0.17082173803981007
a couple are running towards the ocean,a man and and woman are running together holding hands,0.5636,0.14291972952214924,0.52226067,0.40845838498213305
a woman is chopping a hard egg,a person is cutting  boiled egg into pieces,0.7066,0.2061369660682861,0.71920955,0.5652877880092676
two robots share a kiss,a male and female robot are kissing,0.76,0.0,0.8026936,0.5618855357170105
a cat is trying to touch a dog,the cat teased the dog by touching his head,0.65,0.14291972952214924,0.6806244,0.5193130106840373
the rhino grazed on the grass,a rhino is grazing in a field,0.8,0.08704446792504217,0.8257905,0.6041666955944927
the man drove his little red car around the traffic,the dog ran in the water at the beach,0.0,0.29526755538240534,0.012307484,0.09719550520675022
a man is cutting bread,a man is doing tricks with a soccer ball,0.2,0.23790309463326237,0.22920062,0.23181135843510658
a cat rapidly swats a kid in the head,a cat and a boy play together,0.52,0.09349477497536716,0.5568129,0.41781745018899075
a cat is playing in a box,the dog is playing with the floor cleaner,0.27999999999999997,0.16836842163679847,0.31557298,0.2714116134174998
the couple danced in the church,a couple slow dances,0.64,0.11671773546032796,0.52334726,0.4013584016355654
a man is patting an alligator on the mouth,a person is dumping chopped vegetables into a pot on the stove,0.0,0.2038037084651848,0.028484087,0.08107997262814225
a person checks some rice pudding,a horse is running,0.0,0.0,0.052573137,0.03680119663476944
a woman is stirring two eggs in a glass bowl,a young girl is singing on a stage,0.0,0.07874460345594508,0.054897398,0.06205155723121292
the man is playing the drums,a man pours cleaner in his sink,0.0,0.07874460345594508,0.1933794,0.1589889565887702
a man is slicing a pepper,a person cuts a big green pepper apart,0.76,0.11521554337793123,0.6690233,0.5028809498156712
a woman is speaking in sign language,a woman spices some seafood,0.1286,0.11521554337793123,0.203702,0.1771560649480031
a boy is crawling into a dog house,a cat is playing on the floor,0.0,0.09193998174078082,0.25222054,0.20413637636961585
the girl flew her kite while she ran up a hill,a girl loses her kite,0.45,0.3278707471841718,0.68926084,0.5808438064859552
a woman is placing food in a pot of hot water,a woman is frying meat,0.25,0.20608363501393825,0.5062306,0.4161865054135443
a small monkey walks through water,a monkey is wading across a marsh,0.6799999999999999,0.11234277891542777,0.61220723,0.46224789144821843
a man is riding a bike,a panda bear is eating,0.0,0.14438355527738675,-0.035111513,0.018737007491051984
a young man is singing and playing the piano,the man is writing a letter,0.04,0.31710746658027106,0.19401523,0.23094289830976705
a boy takes off his sunglasses,a boy is screaming,0.1,0.1506401849870651,0.22801036,0.20479930201425461
a girl is playing a piano,a boy is doing push ups,0.0,0.12735952979479354,0.06971185,0.08700615181372798
the lady sliced a tomatoe,someone is cutting a tomato,0.8,0.0,0.7210934,0.5047653913497925
someone is holding a hedgehog,a onion is being sliced,0.0,0.14438355527738675,0.12596297,0.13148914892202598
a woman peels a potato,a woman is grilling pineapples,0.2,0.1707761131901165,0.2945618,0.2574260873549765
a cat is drinking some water,a truck is going down a hill,0.0,0.11234277891542777,0.028287224,0.05350388968713958
a person is putting salt and pepper on a piece of pork,a youngster is sitting on a piano,0.0,0.16836842163679844,0.07038262,0.09977835868083788
the man sat in his chair and stared,the little girl is putting her hair into a pony tail,0.0,0.05992996822422367,-0.0145426765,0.007799116911368434
a woman is dicing a potato,a woman cuts tofu into tiny pieces,0.36,0.11521554337793123,0.3592506,0.286040086587827
a baby is crawling happily,a baby sneezed and scared another baby,0.24,0.22028815056182974,0.28718787,0.26711795123010285
a person is frying a meat in the pan,a man is cutting a vegetable,0.12,0.10599213135093251,0.2939889,0.2375898727531725
a man is looking out of a window,a woman is swimming in the water,0.05,0.09193998174078082,-0.06475752,-0.017748269152024942
a man seated is playing the guitar,a man is playing an acoustic guitar and singing into a microphone,0.65,0.35630042933313816,0.60986906,0.5337984728303217
a woman is slicing an onion with a knife,a man is preparing some dish,0.25,0.09349477497536716,0.24903205,0.20237085881173247
a rider is running and jumping her horse,a woman jumps hurdles on a horse,0.8,0.09349477497536716,0.6216744,0.4632205134862625
a boy is playing a keyboard,a boy is sitting in a room playing a piano by lamp light,0.65,0.3278707471841718,0.5437921,0.47901570818883615
two men are fighting,the man is exercising,0.15,0.0,0.23798317,0.1665882170200348
a man is playing a wooden flute while several other men play bongo drums,a man is playing a flute,0.65,0.44943641652398214,0.69550925,0.6216873855284837
a person is petting a monkey,a man is holding a slow loris,0.24,0.12735952979479354,0.18940356,0.17079034461424983
two cartoon rabbits are kissing,a rabbit is kissing another rabbit,0.76,0.09349477497536716,0.84648275,0.6205863720411026
the hedgehog chewed on the towel,a hedgehog is biting at a blanket,0.6799999999999999,0.08704446792504217,0.67524284,0.4987833292481334
a cat is licking himself,a man is slicing a white onion with a mandolin slicer,0.0,0.09867961797986957,0.09234114,0.09424267886243622
a small guinea pig is gnawing and eating a piece of carrot on the floor,a guinea pig eats a carrot,0.7,0.28196020042685593,0.8124559,0.6533071491592762
four boys are standing in front of the burning car,four young men stand still as a car explodes behind them,0.75,0.11234277891542774,0.6213312,0.4686346781475135
a man is smoking,the man sat in his suit and smoked,0.8,0.11671773546032796,0.5954522,0.4518318532499453
a woman is adding sauce to some food,a person is cutting leaves,0.04,0.10599213135093251,0.08719075,0.09283116025283872
three children are eating their food,the deer jumped over the fence,0.0,0.0,-0.08177972,-0.057245802134275436
a submarine is going through water,a baby is falling asleep,0.0,0.12735952979479354,0.06213592,0.08170300363348162
a man is running on a street,a man plays the guitar,0.16,0.12735952979479354,0.25535232,0.21695448471949733
a person is slicing an onion,a cat is pooping into a toilet,0.0,0.11234277891542777,0.07670401,0.08739564018674571
a badger is digging in the dirt,a man is moving large rocks,0.0,0.10163066979112656,0.2455594,0.20238077102858554
a woman is slicing big pepper,a dog is moving its mouth,0.0,0.11234277891542777,0.030783422,0.055251229651052544
a man is riding a bicycle,a man is riding a bike,1.0,0.6029748160380571,0.9208033,0.8254547488313451
a man and a woman are kissing each other,a man and a woman are talking to each other,0.12,0.6735205045780813,0.6484597,0.6559779164624594
a woman is slicing an onion,a woman is cutting an onion,0.8400000000000001,0.6694188517266485,0.9136106,0.8403530359844558
a small boy is playing with a dog,a baby is playing with a dog,0.75,0.5803329846765686,0.5664611,0.5706226557942059
the man is drawing,a man is drawing,1.0,0.7765145304745157,0.9934499,0.9283693195267235
a man is cutting a potato,a woman is cutting a tomato,0.25,0.3360969272762575,0.4956488,0.4477832450720679
a boy is playing a guitar,a kid is playing a guitar,0.72,0.6029748160380572,0.87478924,0.7932448756318823
a woman is cutting an onion,a woman is cutting through an onion,1.0,0.8466473536503037,0.964654,0.9292520081046736
a toy train is striking a toy car,a toy train strikes a toy car,1.0,0.6735205045780813,0.97450656,0.8842107472253226
a man is playing the guitar,a man is playing the flute,0.44000000000000006,0.6694188517266485,0.49147964,0.5448614001850478
a cat opens a drawer and climbs inside,a cat is opening a drawer and climbing inside,1.0,0.45026814465562653,0.9685447,0.8130617604399923
a woman is frying a food,a woman is deep frying food,0.85,0.8181802073667197,0.9053522,0.8792005669936462
a man is dicing an onion,a woman is cutting an onion,0.5,0.43161341897075156,0.6295699,0.570182947371676
a girl is playing a guitar,a man is playing a guitar,0.5599999999999999,0.6029748160380572,0.58497894,0.5903776955228582
a girl is singing on stage,a man is singing on stage,0.5599999999999999,0.6694188517266485,0.640612,0.6492540479282729
a woman is riding a horse,a woman is riding a donkey,0.5599999999999999,0.6029748160380571,0.68052566,0.6572603952508702
a girl is playing a guitar,a man is playing a guitar,0.5599999999999999,0.6029748160380572,0.58497894,0.5903776955228582
a woman is brushing some shrimp,a woman brushes some shrimp,1.0,0.5101490193104813,0.9462225,0.815400426790001
a man is dancing on the ceiling,a man is dancing on the ceiling of a room,0.96,0.7765145304745156,0.92396486,0.8797297240181481
a woman thinly slices an onion with a large knife,a woman is slicing onions with a large knife,0.8400000000000001,0.368023208756115,0.9152349,0.7510714209016758
a man is playing a keyboard,a man plays a keyboard,1.0,0.4112070550676187,0.9870907,0.814325623218894
a man plays the guitar,a man is playing the guitar,1.0,0.5101490193104814,0.98107463,0.8397969655244372
a woman is peeling a potato,a woman peels a potato,1.0,0.4112070550676187,0.9537916,0.7910162136005163
a woman is handling a frog,a man is holding a frog,0.75,0.3360969272762575,0.57180995,0.5010960235449683
a man is playing a flute,a man is playing a guitar,0.4,0.6029748160380571,0.5359287,0.5560425591092839
a man is playing a guitar,a man is playing a flute,0.3166,0.6029748160380571,0.5359287,0.5560425591092839
a man is playing a piano,a man is playing a guitar,0.3556,0.6029748160380571,0.52734715,0.5500354539972081
a man is playing a guitar,a man is playing a piano,0.4,0.6029748160380571,0.52734715,0.5500354539972081
a man is playing a flute,a man is playing a guitar,0.4,0.6029748160380571,0.5359287,0.5560425591092839
a man is playing a flute,a man is playing a guitar,0.4,0.6029748160380571,0.5359287,0.5560425591092839
two women are on a couch,two women are hugging on a couch,0.64,0.8466473536503037,0.79580164,0.8110553418639814
someone is slicing a cucumber,a man is slicing a cucumber,0.76,0.6029748160380572,0.910923,0.8185385238748327
a kitten is playing with a blue rope toy,a kitten is playing with a toy,0.8800000000000001,0.7474073540060464,0.8096932,0.7910074225332958
the dog is barking at the toy,a dog is barking at a toy,1.0,0.6225407468137513,0.96259654,0.8605797990220001
a person folds a tortilla,a man folds a tortilla,0.7,0.5031026124151314,0.9129993,0.790030262446158
a cat is drinking milk,a kitten is drinking milk,0.8,0.6029748160380572,0.86325836,0.7851732742410437
a person is driving a car,a man is driving a car,0.7,0.6029748160380572,0.8063557,0.7453414570909277
a turtle is walking,a tortoise is walking,0.8800000000000001,0.5031026124151314,0.6619055,0.6142646586654116
a cow is eating grass,a cow is eating hay,0.76,0.6029748160380571,0.78667784,0.7315669428926244
a woman is chopping broccoli,a woman is chopping garlic,0.52,0.6029748160380571,0.6608237,0.6434690427404179
a man is crying,a man is screaming,0.6,0.5031026124151314,0.6862056,0.6312747215983797
the man is playing the guitar,a man is playing guitar,1.0,0.5797386715376657,0.97440624,0.8560059830416524
a man is cutting an onion,a man is cutting a plantain,0.7333999999999999,0.5101490193104813,0.61233395,0.5816784552781602
a man is slicing a potato,a woman is peeling a potato,0.4666,0.3360969272762575,0.5875598,0.5121209456774604
a woman is tapping her fingers on a table,a woman is tapping her fingers,0.8,0.7474073540060465,0.8659997,0.8304220071699842
someone is boiling okra in a pot,someone is cooking okra in a pan,0.8800000000000001,0.5031026124151314,0.75059664,0.6763484096286226
a man is smoking,a man is mixing,0.04,0.5031026124151314,0.4208427,0.44552066085314046
the man is playing the drums,a man is playing drums,1.0,0.5797386715376657,0.97001225,0.8529301449526632
a man dives into a pool,a man is diving into a pool,1.0,0.5101490193104814,0.96721995,0.8300986341683886
a woman is cutting a leak,a woman is slicing a leek,0.8,0.3360969272762575,0.43078202,0.4023764862868201
a little boy is playing a guitar,a boy is playing guitar,0.9199999999999999,0.8181802073667197,0.88064265,0.8619038951262756
a woman is dancing,the man is dancing,0.52,0.4112070550676187,0.52591145,0.49150013179051877
women are talking,the men are talking,0.52,0.4112070550676187,0.50015193,0.4734684750484228
a girl is putting gel in her hair,a woman is putting gel on her hair,0.52,0.5586177528223195,0.8365983,0.7532041198110818
a kid is playing guitar,a man is playing a guitar,0.44000000000000006,0.6029748160380572,0.6484796,0.6348281573873297
a group of people are marching in place,a group of people are dancing in concert,0.33999999999999997,0.5586177528223195,0.4809156,0.5042262500620126
the woman is shooting a machine gun,the man is shooting a gun,0.4,0.5803329846765686,0.5585684,0.5650977820606854
a man played the piano,a man plays a piano,0.8,0.4112070550676187,0.96271443,0.7972621843265295
a woman is slicing an onion,someone is slicing a onion,0.65,0.5101490193104813,0.8930763,0.7781981281487962
a man is slicing a cucumber,a man is cutting cucumbers,0.9,0.3360969272762575,0.85568225,0.6998066439482581
a girl is eating a cupcake,a woman is eating a cupcake,0.52,0.6029748160380572,0.79612964,0.7381831776719824
a woman is cutting an onion,a man is chopping an onion,0.4,0.43161341897075156,0.72581387,0.6375537197334313
the man is playing a guitar,a baby is playing a guitar,0.36,0.5101490193104813,0.5878746,0.5645569018571397
a man is playing the guitar,a man is playing the drums,0.31120000000000003,0.6694188517266485,0.46409106,0.5256893873791091
two little girls talk on the telephone,two girls talk on the phone,0.9,0.6327904583679949,0.89538133,0.8166040576001201
a man is chopping a log with an axe,a man is chopping a tree trunk with an axe,0.8,0.6735205045780813,0.80134493,0.7629976091218375
a person is cutting a capsicum into pieces,a person is slicing a garlic into pieces,0.32,0.5031026124151314,0.6140045,0.5807339167354036
a man is talking with a woman,a woman is walking with a dog,0.1,0.43161341897075156,0.21859011,0.2824971060497307
the man is walking,a man is talking,0.27999999999999997,0.4112070550676187,0.39912575,0.4027501270221472
someone is pouring oil into a skillet,someone is pouring milk into a blender,0.32,0.5031026124151314,0.44422898,0.4618910765407015
a small kitten is playing a ball,a kitten is playing with a ball,0.8800000000000001,0.6694188517266485,0.91483617,0.8412109852413527
a man is playing a guitar,a woman is playing a flute,0.36,0.3360969272762575,0.31137508,0.31879162631958835
a girl is playing a violin,a girl is playing a flute,0.52,0.6029748160380571,0.6435874,0.6314036321264043
a man is playing two pianos,a cat is playing a piano,0.32,0.2912194185636897,0.46452117,0.41253065029330427
a man is exercising,a girl is exercising,0.6,0.5031026124151314,0.45196193,0.46730413196062337
a person is slicing a scallop,a person is slicing octopus,0.4,0.6029748160380571,0.71342933,0.6802929710965886
a man and a woman are riding on their bicycles,a man and woman are riding a motorcycle,0.4,0.5727393584196199,0.7137604,0.6714540766699442
two men are fighting in a cow pasture,two men are fighting in a cattle pen,0.8,0.5586177528223196,0.7709049,0.7072187191343546
a woman is adding oil to a pan,a man is pouring oil into a pan,0.6,0.3360969272762574,0.6921792,0.5853545203062903
a girl makes up her bed,a young girl makes her bed,0.8800000000000001,0.6694188517266485,0.8866626,0.8214894772152297
the cat played with a watermelon,a cat is playing with a watermelon,0.96,0.43161341897075156,0.96232843,0.8031139056427026
a girl jumps on a car,a girl is jumping onto a car,0.96,0.2912194185636897,0.93738073,0.7435323194617766
a man is praying,a man is running,0.1454,0.5031026124151314,0.30126944,0.36181939301466237
a car is parking,a cat is playing,0.0,0.20199309249791836,0.09498004,0.12708395111582677
a man is running,a man is dancing,0.25,0.5031026124151314,0.38298875,0.41902290937875997
a man is singing,a man is dancing,0.1,0.5031026124151314,0.4362808,0.45632734057878743
a man is carrying another man over his shoulder,a man is carrying someone on his shoulder,0.65,0.580133027144287,0.87948227,0.7896775085651916
a woman is peeling a potato,a woman is slicing a tomato,0.2666,0.3360969272762575,0.5554302,0.48963020585507266
a woman is cutting a tomato,a woman is slicing a potato,0.2,0.3360969272762575,0.61155677,0.5289188160750281
someone is peeling a potato,someone is slicing a tomato,0.27999999999999997,0.3360969272762575,0.5261123,0.46910770081013553
a woman is peeling a potato,a woman is slicing a tomato,0.2666,0.3360969272762575,0.5554302,0.48963020585507266
two robots kiss,two robots are kissing,1.0,0.4112070550676187,0.9454016,0.7851432487415075
two boys on a couch are playing video games,two boys are playing a video game,0.8,0.5727393584196199,0.852836,0.7688070284350046
a woman is squeezing a lemon,a woman is squeezing juice out of a lemon,0.8800000000000001,0.6348087971775132,0.908104,0.8261154468467353
a woman is slicing an onion,a man is slicing a tomato,0.24,0.2912194185636897,0.5248767,0.4547795251960295
a woman is slicing a carrot,a man is slicing a tomato,0.24,0.3360969272762575,0.55779254,0.4912838473173987
a girl is styling her hair,a girl is filing her nails,0.25,0.43161341897075156,0.48717618,0.47050735161133045
a man walking down the stairs,a man walks down a staircase,1.0,0.2912194185636897,0.94675046,0.7500911549682158
two people are riding a motorcycle,two people are riding a bike,0.4,0.6694188517266485,0.7630759,0.7349787593464248
a man is playing a guitar,a woman is playing an electric guitar,0.44000000000000006,0.45017550232698983,0.59621763,0.5524049992641522
a man is playing a guitar and singing,a man is playing a guitar,0.64,0.7092972666062738,0.81076074,0.7803216597449132
a man is walking in the rain,a man and woman is walking in the grand,0.3,0.5727393584196199,0.2556877,0.3508032011015543
a kangaroo is eating,kangaroo eating,0.95,0.7092972666062739,0.92863584,0.8628342768561192
a man is fishing,a man is exercising,0.1,0.5031026124151314,0.31976327,0.3747650748250414
a woman is swimming,a man is singing,0.0134,0.20199309249791836,-0.066417575,0.014105626821736494
a woman is eating,a animal is eating,0.32,0.5031026124151314,0.5709504,0.5505960499999453
a boy and a girl is dancing in the rain,a man and woman is dancing in the rain,0.52,0.6029748160380572,0.80951476,0.7475527894120947
a man is driving a car,a man drives a car,0.975,0.4112070550676187,0.940601,0.7817827984737158
a woman is grating onion,a woman grates onions,1.0,0.1707761131901165,0.90581816,0.685305554961521
two roosters are fighting,two men are fighting,0.4,0.6029748160380572,0.59336126,0.5962453257661596
a man is riding a horse,a man is driving a car,0.27999999999999997,0.3360969272762575,0.30243212,0.3125315590950858
a man is riding a horse,a man is driving a car,0.27999999999999997,0.3360969272762575,0.30243212,0.3125315590950858
a man is shooting a gun,a man is slicing a bun,0.16,0.3360969272762575,0.20977399,0.24767087243527286
a woman is cutting an onion,a woman is cutting meat,0.4,0.5101490193104813,0.590104,0.5661175004689714
the woman is slicing herbs,the man is slicing bread,0.32,0.43161341897075156,0.4052354,0.41314881846733326
a boy is playing the piano,a man is playing a piano,0.6,0.5101490193104813,0.72859657,0.6630622796266099
a baby elephant is eating,a baby elephant eats a sapling,0.7230000000000001,0.3360969272762575,0.8807447,0.7173503770682227
a woman is cracking eggs into a bowl,a woman is cracking eggs,0.8,0.7092972666062738,0.8906342,0.8362330815207311
a person is playing the keyboard,a boy is playing a keyboard,0.8,0.5101490193104813,0.7881732,0.7047659210412522
a boy whacks a man with a sword,a boy spanks a man with a plastic sword,0.6666000000000001,0.5803329846765686,0.7580713,0.7047497958393719
a person is slicing a carrot into pieces,a person is cutting an onion into pieces,0.3,0.45026814465562653,0.68167293,0.6122514770175222
a man sliced through a bunch of water bottles with a knife,a man is slicing a line of water bottles with a knife,0.8800000000000001,0.5031026124151314,0.8905518,0.7743170475718905
a man is writing in a book,a man is writing on a paper,0.575,0.43161341897075156,0.7138995,0.6292136590225244
a woman is slicing a garlic,a woman is slicing a big pepper,0.44000000000000006,0.5101490193104813,0.7257303,0.6610559276788255
a person is making a bed,a person is eating at a table,0.04,0.2912194185636897,0.25435734,0.2654159561748045
a man is playing keyboard,a man is playing guitar,0.36,0.6029748160380571,0.47836864,0.5157504748922124
a man is playing a violin,a man is playing a harp,0.32,0.6029748160380571,0.57281137,0.5818604004007115
the woman is smoking,the man is walking,0.04,0.3360969272762575,-0.105856106,0.026729805693329514
the man erased what the other man had on the board,the man erased the work on the board,0.6,0.7726096588104405,0.833158,0.8149934851446581
a man is riding a motorcycle,a man is riding a motorcycle through a town,0.7,0.7092972666062738,0.7832701,0.7610782405745335
a man is riding a motorcycle on the highway,a man is riding a motorcycle,0.7,0.6348087971775132,0.80785763,0.7559429581573127
a woman is slicing up some meat,a woman is slicing some onions,0.4,0.5803329846765686,0.69826406,0.6628847450466778
a woman cuts up broccoli,a woman is cutting broccoli,1.0,0.3360969272762575,0.9291053,0.751202775463761
a man is playing a piano,a woman is peeling a potato,0.0,0.14438355527738675,0.074071884,0.09516538549190742
someone is slicing a tomato,someone is slicing fruit,0.64,0.6029748160380571,0.79933476,0.7404267561059727
a woman is dancing in a cage,a woman is dancing,0.65,0.6569729210330907,0.70534384,0.6908325541434843
a woman is swimming,a man is spitting,0.0,0.20199309249791836,-0.03922835,0.033138082802514235
a man is running,a man is mooing,0.2,0.5031026124151314,0.42233795,0.4465673482177187
the man is playing the guitar,the man played his guitar,0.7333999999999999,0.4809731079601445,0.8975905,0.7726052949864626
a cat stares into the camera,a cat addresses the camera,0.6,0.5101490193104813,0.8366772,0.7387187532632371
the baby is laughing and crawling,a baby is laughing and crawling on the floor,0.8400000000000001,0.7765145304745156,0.89150476,0.8570076585693871
a woman is shooting a gun,a woman shoots a shotgun,0.8182,0.1707761131901165,0.8318093,0.6334993434899634
a woman is dancing in the rain,a woman is dancing in railway station,0.4,0.5031026124151314,0.44827372,0.4647223865744997
a woman is dancing,a woman is exercising,0.2,0.5031026124151314,0.5569436,0.5407912945506502
a kid is playing an instrument,a young boy is playing a wind instrument,0.76,0.38087260847594373,0.7659856,0.6504516962924779
someone slices a bottle with a sword,a man breaks a bottle with a sword,0.8,0.43161341897075156,0.77234,0.6701219956619286
a woman is cutting an apple,a woman is cutting potato,0.36,0.5101490193104813,0.6687599,0.6211766056268235
the man is peeling an apple,a man peels an apple,1.0,0.4501755023269897,0.9522209,0.8016072805008008
the man is playing the guitar,the man is playing with a skull,0.2,0.5918927626373602,0.35688064,0.4273842762876222
an animal is walking on the ground,a solenodon is walking along the ground,0.6,0.45026814465562653,0.59618044,0.5524067447329764
a little girl is playing a grand piano on stage,a little girl is playing the piano,0.52,0.5727393584196199,0.850145,0.7669232832415231
a group of people dancing,a group of men are dancing,0.6799999999999999,0.5101490193104813,0.7984452,0.7119563273637315
a man plays a guitar,a woman is playing guitar,0.4,0.1707761131901165,0.62714803,0.4902364505284613
a cat swings on a ceiling fan,a cat is spun around by a ceiling fan,0.8400000000000001,0.3446421410380548,0.84219265,0.6929274614375456
a woman is playing the flute,a girl is playing a flute,0.76,0.5101490193104813,0.81068087,0.720521276399376
the woman is dicing onions,a woman is cutting an onion,0.8800000000000001,0.25233420143369617,0.8006309,0.6361418736274355
a monkey is brushing a bull dog,a monkey brushes a dog,0.8400000000000001,0.35630042933313816,0.88193,0.7242411243405603
a woman is slicing a onion,a woman is cutting a potato,0.24,0.3360969272762575,0.653233,0.5580921604487311
a man is playing the piano,a woman is playing a guitar,0.24,0.2912194185636897,0.19728309,0.22546399096198258
a woman is washing her hands,a woman is straightening her hair,0.16,0.43161341897075156,0.2680509,0.31711965606041187
a woman fires a shotgun,a woman is shooting a gun,0.64,0.1707761131901165,0.757583,0.5815409613602942
a man is eating a bowl of cereal,the man is eating cereal,0.8,0.5803329846765686,0.9352387,0.8287669748516705
a woman is bathing into bathtub,a woman is taking a bath,0.8800000000000001,0.2912194185636897,0.8008405,0.6479541854018706
a motorcyclist crashes on his motorcycle,a person crashes on a motorcycle,0.8400000000000001,0.5101490193104813,0.8868942,0.7738706521241685
a man is dangling a mouse near a snake,a man is feeding a mice to a snake,0.64,0.3360969272762574,0.6329229,0.5438750817629706
a man and a woman are walking in the woods,a man and woman are walking through the jungle,0.6799999999999999,0.6029748160380572,0.7240503,0.6877276074510351
a person pours some rice pudding into a bowl,the lady poured the rice pudding into a bowl,0.8,0.31888272749308855,0.8085933,0.6616801213828448
